{
  "$schema": "../schemas/skill-review-status.schema.json",
  "candidate_count": 5,
  "generated_by": "tools/build_skill_reviews.py",
  "promotion_ready_count": 0,
  "release": "v0.4.0",
  "schema_version": "0.1.0",
  "skills": [
    {
      "blockers": [
        {
          "detail": "An independent domain reviewer approved the pinned commit.",
          "id": "domain-review"
        },
        {
          "detail": "A maintainer recorded the final promotion decision.",
          "id": "maintainer-decision"
        }
      ],
      "bundle_path": "reviews/v0.4.0/job-failure-triage.json",
      "bundle_sha256": "fad5e2e70d017ec422f5a3748f7384e79617eba5b3abc5ab17a1139fcc0da765",
      "current_maturity": "seed",
      "evidence": {
        "adoption_report_count": 0,
        "agent_task_count": 1,
        "benchmark_case_count": 3,
        "example_count": 2,
        "readme": "skills/job-failure-triage/README.md"
      },
      "id": "job-failure-triage",
      "name": "Job Failure Triage",
      "promotion_ready": false,
      "quality": {
        "band": "strong",
        "gaps": [],
        "score": 98
      },
      "release": "v0.4.0",
      "requirements": [
        {
          "category": "static",
          "detail": "Quality band is strong.",
          "id": "quality-strong",
          "status": "passed"
        },
        {
          "category": "static",
          "detail": "Quality report has no gaps.",
          "id": "quality-gaps-closed",
          "status": "passed"
        },
        {
          "category": "static",
          "detail": "At least one static or fixture benchmark references the skill.",
          "id": "benchmark-evidence",
          "status": "passed"
        },
        {
          "category": "static",
          "detail": "At least one agent benchmark task references the skill.",
          "id": "agent-task-evidence",
          "status": "passed"
        },
        {
          "category": "review",
          "detail": "A public maturity-review issue is linked.",
          "id": "public-review-issue",
          "status": "passed"
        },
        {
          "category": "review",
          "detail": "Review is pinned to one full Git commit.",
          "id": "review-commit",
          "status": "passed"
        },
        {
          "category": "review",
          "detail": "An independent domain reviewer approved the pinned commit.",
          "id": "domain-review",
          "status": "pending"
        },
        {
          "category": "review",
          "detail": "Required safety review approved the pinned commit.",
          "id": "safety-review",
          "status": "passed"
        },
        {
          "category": "review",
          "detail": "A maintainer recorded the final promotion decision.",
          "id": "maintainer-decision",
          "status": "pending"
        }
      ],
      "review_commit": "55b90ad8dbb8fcf9e1e0656a95889217a02c6ab5",
      "review_issue": "https://github.com/hwang595/hpc-skill-hub/issues/30",
      "risk_level": "low",
      "safety_review_required": false,
      "static_ready": true,
      "status": "awaiting-review",
      "target_maturity": "reviewed",
      "validation_errors": [],
      "version": "0.2.0"
    },
    {
      "blockers": [
        {
          "detail": "An independent domain reviewer approved the pinned commit.",
          "id": "domain-review"
        },
        {
          "detail": "Required safety review approved the pinned commit.",
          "id": "safety-review"
        },
        {
          "detail": "A maintainer recorded the final promotion decision.",
          "id": "maintainer-decision"
        }
      ],
      "bundle_path": "reviews/v0.4.0/shared-project-permissions-triage.json",
      "bundle_sha256": "6fc47a21e26541973ab69c3b9ca981986901b47bbeda91f6abe2bb7bc5ec8d5b",
      "current_maturity": "seed",
      "evidence": {
        "adoption_report_count": 0,
        "agent_task_count": 1,
        "benchmark_case_count": 1,
        "example_count": 3,
        "readme": "skills/shared-project-permissions-triage/README.md"
      },
      "id": "shared-project-permissions-triage",
      "name": "Shared Project Permissions Triage",
      "promotion_ready": false,
      "quality": {
        "band": "strong",
        "gaps": [],
        "score": 100
      },
      "release": "v0.4.0",
      "requirements": [
        {
          "category": "static",
          "detail": "Quality band is strong.",
          "id": "quality-strong",
          "status": "passed"
        },
        {
          "category": "static",
          "detail": "Quality report has no gaps.",
          "id": "quality-gaps-closed",
          "status": "passed"
        },
        {
          "category": "static",
          "detail": "At least one static or fixture benchmark references the skill.",
          "id": "benchmark-evidence",
          "status": "passed"
        },
        {
          "category": "static",
          "detail": "At least one agent benchmark task references the skill.",
          "id": "agent-task-evidence",
          "status": "passed"
        },
        {
          "category": "review",
          "detail": "A public maturity-review issue is linked.",
          "id": "public-review-issue",
          "status": "passed"
        },
        {
          "category": "review",
          "detail": "Review is pinned to one full Git commit.",
          "id": "review-commit",
          "status": "passed"
        },
        {
          "category": "review",
          "detail": "An independent domain reviewer approved the pinned commit.",
          "id": "domain-review",
          "status": "pending"
        },
        {
          "category": "review",
          "detail": "Required safety review approved the pinned commit.",
          "id": "safety-review",
          "status": "pending"
        },
        {
          "category": "review",
          "detail": "A maintainer recorded the final promotion decision.",
          "id": "maintainer-decision",
          "status": "pending"
        }
      ],
      "review_commit": "55b90ad8dbb8fcf9e1e0656a95889217a02c6ab5",
      "review_issue": "https://github.com/hwang595/hpc-skill-hub/issues/33",
      "risk_level": "low",
      "safety_review_required": true,
      "static_ready": true,
      "status": "awaiting-review",
      "target_maturity": "reviewed",
      "validation_errors": [],
      "version": "0.2.0"
    },
    {
      "blockers": [
        {
          "detail": "An independent domain reviewer approved the pinned commit.",
          "id": "domain-review"
        },
        {
          "detail": "A maintainer recorded the final promotion decision.",
          "id": "maintainer-decision"
        }
      ],
      "bundle_path": "reviews/v0.4.0/slurm-oom-memory-triage.json",
      "bundle_sha256": "0d4a7fe5a963cd37710cde4a63c938301ae4d5a22c19502a7bcb72befc448e34",
      "current_maturity": "seed",
      "evidence": {
        "adoption_report_count": 0,
        "agent_task_count": 1,
        "benchmark_case_count": 1,
        "example_count": 3,
        "readme": "skills/slurm-oom-memory-triage/README.md"
      },
      "id": "slurm-oom-memory-triage",
      "name": "Slurm OOM Memory Triage",
      "promotion_ready": false,
      "quality": {
        "band": "strong",
        "gaps": [],
        "score": 100
      },
      "release": "v0.4.0",
      "requirements": [
        {
          "category": "static",
          "detail": "Quality band is strong.",
          "id": "quality-strong",
          "status": "passed"
        },
        {
          "category": "static",
          "detail": "Quality report has no gaps.",
          "id": "quality-gaps-closed",
          "status": "passed"
        },
        {
          "category": "static",
          "detail": "At least one static or fixture benchmark references the skill.",
          "id": "benchmark-evidence",
          "status": "passed"
        },
        {
          "category": "static",
          "detail": "At least one agent benchmark task references the skill.",
          "id": "agent-task-evidence",
          "status": "passed"
        },
        {
          "category": "review",
          "detail": "A public maturity-review issue is linked.",
          "id": "public-review-issue",
          "status": "passed"
        },
        {
          "category": "review",
          "detail": "Review is pinned to one full Git commit.",
          "id": "review-commit",
          "status": "passed"
        },
        {
          "category": "review",
          "detail": "An independent domain reviewer approved the pinned commit.",
          "id": "domain-review",
          "status": "pending"
        },
        {
          "category": "review",
          "detail": "Required safety review approved the pinned commit.",
          "id": "safety-review",
          "status": "passed"
        },
        {
          "category": "review",
          "detail": "A maintainer recorded the final promotion decision.",
          "id": "maintainer-decision",
          "status": "pending"
        }
      ],
      "review_commit": "55b90ad8dbb8fcf9e1e0656a95889217a02c6ab5",
      "review_issue": "https://github.com/hwang595/hpc-skill-hub/issues/35",
      "risk_level": "low",
      "safety_review_required": false,
      "static_ready": true,
      "status": "awaiting-review",
      "target_maturity": "reviewed",
      "validation_errors": [],
      "version": "0.2.0"
    },
    {
      "blockers": [
        {
          "detail": "An independent domain reviewer approved the pinned commit.",
          "id": "domain-review"
        },
        {
          "detail": "A maintainer recorded the final promotion decision.",
          "id": "maintainer-decision"
        }
      ],
      "bundle_path": "reviews/v0.4.0/slurm-output-log-triage.json",
      "bundle_sha256": "65b131f955d0bcbcda4ceaee3f3d086c9b9450b189af5238951b6acc7c116201",